client,headline,body,cta,performance_score,platform
FitFlow,Stop Paying Full Price for Premium Fitness,"Summer is here. Your goals aren't going to wait. Get 50% off our premium plan — cardio, strength, and nutrition coaching included. No contracts. Cancel anytime.",Learn More,94.2,Meta
FitFlow,Your Dream Body Isn't a Dream Anymore,"Join 200,000 women who transformed their health with our app. Expert trainers. Real results. Real fast.",Sign Up,91.8,Meta
FitFlow,Fitness That Fits Your Life,"Morning person? Night owl? Busy mom? Our adaptive workouts fit around you — not the other way around. Premium plans now 50% off.",Learn More,89.5,Meta
FitFlow,FitFlow Gets Smarter With You,"Most apps give you a plan and forget you. Ours learns from your progress and adapts every week. Summer sale: 50% off premium.",Sign Up,87.3,Google
FitFlow,Don't Just Get Fit — Stay Fit,"The secret to lasting results isn't willpower — it's the right system. Our AI coach keeps you on track even on your worst days. 50% off this week only.",Get My Plan,85.1,Google
FitFlow,AI Fitness Built for Your Life,"Your schedule changes. Your coach should too. FitFlow adapts every week so you never fall behind. Start your free 7-day trial today.",Learn More,83.4,Google
FitFlow,30 Minutes. No Gym. Real Results,"Our HIIT programs are built for real life. No equipment needed. No commute. Science-backed workouts that fit your schedule. Limited time: premium plans at half price.",Shop Now,83.7,TikTok
FitFlow,She Lost 20lbs Without Changing Her Schedule,"Meet Sarah. Full-time job. Two kids. Zero excuses. Here's exactly what she did — and how you can too.",Watch Her Story,82.4,TikTok
FitFlow,Your Coach Adapts So You Don't Have To,"Download an app. Stick to it for a week. Then life happens. FitFlow is the one that actually moves with you — not against you. Try it free.",Get My Plan,80.1,TikTok
FitFlow,50% Off Premium — Today Only,AI fitness coaching that adapts to your life.,Learn More,87.4,Display
FitFlow,Your AI Fitness Coach Is Waiting,Workouts that fit around you. Summer Sale: 50% off.,Get My Plan,84.1,Display
FitFlow,Invest in Your Team's Health,"Corporate wellness programs that actually engage employees. FitFlow Business gives your team personalized AI coaching — reducing burnout and boosting productivity. Trusted by 200+ companies.",Book a Demo,86.4,LinkedIn
FitFlow,Employee Wellness That Delivers ROI,"When your team moves more, they perform better. FitFlow Business: AI-powered fitness coaching for teams of 50+. 90-day pilot available.",Get a Pilot,83.7,LinkedIn
Acme Corp,Double Your Sales Pipeline in 90 Days,"Our CRM doesn't just track deals — it closes them. AI-powered follow-ups, smart lead scoring, and pipeline forecasting built for growth teams.",Book a Demo,90.1,LinkedIn
Acme Corp,Stop Losing Deals to Slow Follow-Up,"Speed wins in sales. Our automated outreach reaches leads in under 5 minutes — before your competitors even open their laptop.",See It in Action,88.6,LinkedIn
Acme Corp,The CRM Your Sales Team Will Actually Use,"Most CRMs create busywork. Ours eliminates it. Reps spend up to 40% more time selling and less time logging. Free trial — no card required.",Start Free Trial,85.9,Google
Acme Corp,AI CRM That Closes Deals Faster,"Automated follow-ups, smart lead scoring, real-time pipeline forecasting. Try free for 14 days.",Start Free Trial,87.2,Google
Acme Corp,Still Thinking About It?,"Thousands of sales teams closed more deals last quarter with Acme CRM. Your competitors aren't waiting. Book a live demo today.",Book a Demo,86.3,Meta
Acme Corp,Your Pipeline Has a Leak,"Lost deals. Slow follow-ups. Untracked leads. Acme CRM finds and fixes the gaps automatically. Free 14-day trial — no card required.",Start Free Trial,83.8,Meta
Acme Corp,Close More Deals,AI CRM built for growth teams. Free 14-day trial.,Book a Demo,84.7,Display
Acme Corp,Less Admin. More Selling.,Acme CRM automates the busywork. See it in action.,See It in Action,82.1,Display
NovaSkin,Science-Backed Skincare That Works,"NovaSkin's clinically tested serum delivers visible results in 14 days. Formulated by dermatologists. Trusted by 50,000+ customers. Free shipping on your first order.",Shop Now,91.2,Meta
NovaSkin,Your Skin Deserves Science,"Premium ingredients. Clinical results. Everyday luxury. NovaSkin Renewal Serum — because results shouldn't require a filter.",Learn More,88.7,Meta
NovaSkin,Dermatologist-Formulated Serum,"Clinically tested for visible results in 14 days. Free shipping on first order.",Shop Now,89.3,Google
NovaSkin,NovaSkin — Visible Results in 14 Days,"See the difference science makes. Try risk-free with our 30-day money-back guarantee.",Try It Now,85.6,Google
NovaSkin,Your Routine Is Missing This,"Clinical-grade ingredients for real people. NovaSkin: dermatologist-tested, community-approved. Real results — no filters needed.",Shop Now,87.1,TikTok
NovaSkin,Science Meets Glow,"50,000+ happy customers. Join the NovaSkin community and see your skin transform in 14 days.",Get Yours,84.3,TikTok
NovaSkin,Clinically Tested. Visibly Proven.,NovaSkin Renewal Serum. Free shipping today.,Shop Now,86.4,Display
NovaSkin,Dermatologist-Trusted Skincare,Results you can see. Science you can trust.,Learn More,83.9,Display
